Name,Explanation,Byline,NIfTI,Creator,Contact,WWW,Availability,HowToGet,Version,Date,OpenSource,License,Free,Requirements,TechPubs,ApplPubs,OtherInfo,Keywords,Platforms,LastIATRupdate,Description
ITK,,Insight Segmentation and Registration Toolkit,,Insight Software Consortium; funded by NLM/NIH,"William J. Schroeder, Kitware, Inc.",http://www.itk.org,Dowload source; CVS access,http://www.itk.org/HTML/Download.php,2.0,September 2004,Yes,None required,Yes,Modern C++ compilers (the latest version) - MS VC++ 6.0 or 7.0 - SGI CC - gcc - Sun CC - Borland,"T.S. Yoo, M.J. Ackerman, W.E. Lorensen, W. Schroeder, V. Chalana, S. Aylward, D. Metaxas, R. Whitaker. Engineering and Algorithm Design for an Image Processing API: A Technical Report on ITK - the Insight Toolkit. Medicine Meets Virtual Reality Conference 2002.",,,"functional, NA-MIC (NCBC), registration, segmentation, statistical","IRIX, Linux, SunOS, UNIX, Windows",20 Apr 2005,"The Insight Segmentation and Registration Toolkit (ITK) is an open-source software toolkit for performing registration and segmentation. Segmentation is the process of identifying and classifying data found in a digitally sampled representation. Typically the sampled representation is an image acquired from such medical instrumentation as CT or MRI scanners.|Registration is the task of aligning or developing correspondences between data. For example, in the medical environment, a CT scan may be aligned with a MRI scan in order to combine the information contained in both.|ITK is implemented in C++. ITK is cross-platform, using the CMake build environment to manage the compilation process. In addition, an automated wrapping process generates interfaces between C++ and interpreted programming languages such as Tcl, Java, and Python (using CableSwig). This enables developers to create software using a variety of programming languages. ITK's C++ implementation style is referred to as generic programming (i.e., using templated code). Such C++ templating means that the code is highly efficient, and that many software problems are discovered at compile-time, rather than at run-time during program execution.|Because ITK is an open-source project, developers from around the world can use, debug, maintain, and extend the software. ITK uses a model of software development referred to as extreme programming. Extreme programming collapses the usual software creation methodology into a simultaneous and iterative process of design-implement-test-release. The key features of extreme programming are communication and testing. Communication among the members of the ITK community is what helps manage the rapid evolution of the software. Testing is what keeps the software stable. In ITK, an extensive testing process (using Dart) is in place that measures the quality on a daily basis. The ITK Testing Dashboard is posted continuously reflecting the quality of the software."
stroketool,,Digital Image Solutions,,Digital Image Solutions / Hans-Joerg Wittsack,info@digitalimagesolutions.de,http://www.digitalimagesolutions.de,see web site,see web site,2.0,,No,"single license, free test license",No,"Processor: Intel x86 compatible, > 128 MB RAM, true color graphics, MS-Windows: WinNT, W2K, WinXP","Wittsack HJ, Ritzl A, Moedder U. 'User friendly analysis of MR investigations of the cerebral perfusion: Windows-based image processing.' Fortschr Roentgenstr 2002; 174: 742-746",,,"functional, perfusion diffusion mr magnetic resonance, visualization",Windows,21 Sep 2005,"stroketool is a user friendly MS-Windows based software system for calculation and visualization of perfusion and diffusion weighted magnetic resonance imaging data sets.|Features: - Quantitative Perfusion using SVD algorithms - Tracer arrival time insensitive approach - DICOM, Siemens Numaris 3, Philips Intera import - DICOM receive/send module - Very fast calculations of rCBF, MTT, rCBV, TTP,Tmax, ... - User friendly with MS-Windows 'look and feel' - Interactive and automatic AIF-detection - Movie tool for visualization of contrast uptake - Variable screen layout - ROI analysis with possibility of volumetric analysis"
Anatomist,,"SHFJ, CEA",,"SHFJ, CEA",mangin@shfj.cea.fr,http://anatomist.info,,http://anatomist.info/download.html,3.0.0,30 june 2005,Yes,CeCILL,Yes,,http://anatomist.info/biblio/en/index.php,,,"atlas, visualization","IRIX, Linux, MacOS, SunOS, UNIX, Windows",01 Jul 2005,"Anatomist is a visualization software, which main originality is a generic module dedicated to structural data, namely sets of objects linked one another into a graph structure. These objects may be cortical folds inferred from T1 weighted MR data, fiber bundles inferred from MR diffusion weighted data, activated clusters inferred from Statistical Parametric Maps, etc... This module includes a nomenclature control panel, which can drive several brains simultaneously. Anatomist provides also some tools to easily map Statistical Parametric Maps on 3D renderings of the brain, inflated meshes of the cortical surface, etc... Finally, a toolbox is dedicated to the manual drawing of Volumes Of Interest made up of set of voxels. Anatomist is the visualisation software used by BrainVISA to show its pipeline results. For this purpose, BrainVISA remote controls Anatomist main menus."
BrainVISA,,IFR 49 Paris/SHFJ CEA,,IFR 49 Paris/SHFJ CEA,mangin@shfj.cea.fr,http://brainvisa.info,,http://brainvisa.info/download.html,3.0.0,30 juin 2005,Yes,CeCILL,Yes,,http://brainvisa.info/biblio/en/index.php,,,"atlas, segmentation, visualization","IRIX, Linux, MacOS, SunOS, UNIX, Windows",01 Jul 2005,"BrainVISA is a software, which embodies an image processing factory. A simple control panel allows the user to trigger some sequences of processing on series of images. These treatments are performed by calls to command lines provided by different laboratories. These command lines, hence, are the building blocks on which are buit the assembly lines of the factory. BrainVISA is distributed with a toolbox of building blocks dedicated to the segmentation of T1-weighted MR images. The product of the main assembly line made up from this toolbox is the following: grey/white classification for Voxel Based Morphometry, Meshes of each hemisphere surface for visualization purpose, Spherical meshes of each hemisphere white matter surface, a graph of the cortical folds, a labeling of the cortical folds according to a nomenclature of the main sulci. A new pipeline has been recently released to perform fiber tracking from MR diffusion weighted images."
DCMTK,,OFFIS DICOM Toolkit,,"OFFIS e.V., Oldenburg, Germany",dicom@offis.de,http://dicom.offis.de/,available,Download via web page or from ftp://dicom.offis.de/pub/dicom/offis/software/,3.5.4,2005-12-20,Yes,BSD-like open source license,Yes,"Compiling from source code requires a C++ compiler and a few third party libraries, all of which are available under license conditions similar to DCMTK's. For the most popular platforms (Windows, Linux, Solaris), pre-compiled binaries are available for download.","Marco Eichelberg, Joerg Riesmeier, Thomas Wilkens, Andrew J. Hewett, Andreas Barth, Peter Jensch: Ten years of medical imaging standardization and prototypical implementation: the DICOM standard and the OFFIS DICOM Toolkit (DCMTK) in: Medical Imaging 2004: PACS and Imaging Informatics, Osman M. Ratib, H. K. Huang, Editors, Proceedings of SPIE Vol. 5371, pp. 57-68 (2004), ISBN 0-8194-5284-X",,,"DICOM, visualization","FreeBSD, HPUX, IRIX, Linux, Linux on 64-bit platforms, MacOS X, NetBSD, OpenBSD, QNX, SunOS, UNIX, Windows",30 Jan 2006,"DCMTK is a collection of libraries and applications implementing large parts of the DICOM standard for medical image communication. It includes software for examining, constructing and converting DICOM image files, handling offline media, sending and receiving images over a network connection, as well as demonstration image storage and worklist servers. DCMTK includes complete source code and is written in a mixture of ANSI C and C++."
FACT,,"Interdisciplinary MRI/MRS Lab, National Taiwan University",,Kai-Hsiang Chuang,khchuang@ntu.edu.tw,http://mr.ee.ntu.edu.tw/~khchuang/fact.html,Free,http://mr.ee.ntu.edu.tw/~khchuang/download.html,4.5,"Sept 15, 2005",No,,Yes,XView library; Cygwin (for MS Windows),"Chuang KH, Chiu MJ, Lin CC, Chen JH. 'Model-free functional MRI analysis using Kohonen clustering neural network and fuzzy C-means.' IEEE Trans Med Imaging. 1999 Dec;18(12):1117-28.","Chuang KH, Wu MT, Lin YR, Hsieh KS, Wu ML, Tsai SY, Ko CW, Chung HW. 'Application of model-free analysis in the MR assessment of pulmonary perfusion ynamics.' Magn Reson Med. 2005 Aug;54(2):299-308.",,functional,"Linux, SunOS, Windows",20 Sep 2005,"FACT (Functional MRI Analysis and Clustering Tools) is a free software for analyzing time series data like fMRI and perfusion MRI. It provides correlation analysis, t-test and temporal clustering analysis -- Kohonen Clustering Network and Fuzzy Clustering."
BAMM,,"University of Cambridge, King's College London and the Wellcome Trust",,"Ed Bullmore, Mick Brammer, John Suckling",co224@cam.ac.uk,www-bmu.psychiatry.cam.ac.uk/software/,Now,http://www-bmu.psychiatry.cam.ac.uk/software/download,See website,See website,Yes,Free for academic use,Yes,"Binary distribution: Solaris and Linux. To compile it yourself from source: C and C++. A small, non-critical, subset of code requires Motif Library. Source code is known to compile on Linux (Debian), Solaris 7 and 8, and Mac OS X.","(BAMM is continuously being developed and as such, it is not possible to maintain an up-to-date list here. For a complete and uptodate list, please visit website http://www-bmu.psychiatry.cam.ac.uk/software/publications/ for more detail),|Brammer MJ, Bullmore ET, Simmons A, Williams SCR, Grasby PM, Howard RJ, Woodruff PWR & Rabe-Hesketh S (1997) Generic brain activation mapping in fMRI: a nonparametric approach. Magnetic Resonance Imaging; 15, 763-770.|Bullmore ET, Brammer MJ, Rouleau G, Everitt BS, Simmons A, Sharma T, Frangou S, Murray RM & Dunn G (1995) Computerised brain tissue classification of magnetic resonance images: a new approach to the problem of partial volume artefact. NeuroImage; 2: 133-147.|Bullmore ET, Rabe-Hesketh S, Morris RG, Williams SCR, Gregory L, Gray JA, Brammer MJ (1996) Functional magnetic resonance image analysis of a large-scale neurocognitive network. NeuroImage; 4: 16-33.|Bullmore ET, Brammer MJ, Rabe-Hesketh S, Janot N, Williams SCR, Mellers JDC, David AS, Howard R & Sham P (1996) Statistical methods of estimation and inference for functional MR image analysis. Magnetic Resonance in Medicine; 35: 261-277.|Bullmore ET, Brammer MJ, Rabe-Hesketh S, Curtis VA, Morris RG, Williams SCR, Sharma T & McGuire PK (1999) Methods for diagnosis and treatment of stimulus correlated motion in generic brain activation studies using fMRI. Human Brain Mapping, 7: 38-48.|Bullmore ET, Suckling J, Overmeyer S, Rabe-Hesketh S, Taylor E & Brammer MJ (1999) Global, voxel and cluster tests, by theory and permutation, for a difference between two groups of structural MR images of the brain. IEEE Transactions on Medical Imaging, 18, 32-42.|Bullmore ET, Brammer MJ, Williams SCR, Curtis VA, McGuire PK, Morris RG, Murray RM & Sharma T (1999) Functional MR imaging of confounded hypofrontality. Human Brain Mapping, 8 86-91.|Bullmore ET, Horwitz B, Honey GD, Brammer MJ, Williams SCR & Sharma T (2000) How good is good enough in path analysis of fMRI data? NeuroImage 11, 289-301.|Bullmore ET & Suckling J (2000) Functional MRI. In The New Oxford Textbook of Psychiatry (Ed. M. Gelder, N. C. Andreasen, J. Lopez-Ibor), 1, 218-223; and International Review of Psychiatry 13, 24-33.|Bullmore ET, Suckling J & Brammer MJ (2001) In praise of tedious permutation. In Spatial Statistics: Methodological aspects and some applications. (Ed. M Moore). Lecture notes in statistics. New York: Springer.|Bullmore ET, Long C, Suckling J, Fadili J, Calvert GA, Zelaya FO, Carpenter TA & Brammer MJ (2001) Colored noise and computational inference in neurophysiological (fMRI) time series analysis: Resampling methods in the time and wavelet domains. Human Brain Mapping, 12, 61-78.|Everitt BS & Bullmore ET (1999) Mixture model mapping of brain activation in functional magnetic resonance images. Human Brain Mapping, 7: 1-14.|Fadili J & Bullmore ET (2001) Wavelet-generalised least squares: a new BLU estimator of regression models with long-memory errors. NeuroImage.|Fadili J, Brett M & Bullmore ET (2001) Wavelet methods for characterising mono- and poly-fractal noise structures in shortish time series: An application to functional MRI. Proceedings ICIP.|Landau S, Wright IC & Bullmore ET (2001) Tests for a difference in timing of physiological response between two brain regions measured using fMRI. Applied Statistics, under review.|Rabe-Hesketh S, Bullmore ET & Brammer MJ (1997) Analysis of functional magnetic resonance images. Statistical Methods in Medical Research: 6, 215-237.|Suckling J, Sigmundsson T, Greenwood K & Bullmore ET (1999) A modified fuzzy clustering algorithm for operator independent brain tissue classification of dual echo MR images. Magnetic Resonance Imaging, 17, 1065-1076.|Suckling J, Brammer MJ, Lingford-Hughes A & Bullmore ET (1999) Removal of extracortical tissues in dual-echo magnetic resonance images via linear scale space features. Magnetic Resonance Imaging, 17, 247-256.|Suckling J & Bullmore ET (2000) Structural MRI. In The New Oxford Textbook of Psychiatry (Ed. M. Gelder, N. C. Andreasen, J. J. Lopez-Ibor), 1, 212-218.|Wright IC, Sharma T, McGuire PK, Sharma T, Friston KJ, Murray RM & Bullmore ET (1999) Supraregional brain systems and the neuropathology of schizophrenia. Cerebral Cortex, 9, 366-378.","(100+ applications papers in total and counting. It is not possible to maintain an up-to-date list here so please refers to the website http://www-bmu.psychiatry.cam.ac.uk/software/publications/u singBAMM/ for a more uptodate listing) Ng VWK, Bullmore ET, de Zubicaray GI, Cooper A & Williams SCR (2001),|Identifying critical nodes in large-scale cortical networks subserving visuospatial processing: an illustration using fMRI. Journal of Cognitive Neuroscience, 13 537-545.|Rubia K, Overmeyer S, Russell T, Brammer MJ, Bullmore ET, Sharma T, Simmons A, Williams SCR, Andrew CM & Taylor E (2001) Mapping motor inhibition: Conjunctive brain activations across different versions of go/no-go and stop tasks. NeuroImage 13, 239-249.|Toosy AT, Werring DJ, Plant GT, Bullmore ET, Miller DH & Thompson AJ (2001) Nasotemporal asymmetries of the ocular dominance regions in human visual cortex demonstrated by functional MRI. NeuroImage 14, 632-641.",,"ANOVA, functional, HBP supported, registration, resampling, statistical, wavelet","Linux, MacOS, UNIX",03 May 2005,"A complete fMRI analysis package created with batch processing in mind. The software comprises the following general functions at the first level of individual image analysis: movement correction (interpolation and regression), time series modeling, data resampling in the wavelet domain, hypothesis testing at voxel and cluster levels. Additionally, there is code for second level analysis - group and factorial or ANOVA mapping - after co-registration of voxel statistic maps from individual images in a standard space. The main point of difference from other fMRI analysis packages is the emphasis throughout on the use of data resampling (permutation or randomization) as a basis for inference on individual, group and factorial test statistics at voxel and cluster levels of resolution. The software is mostly written in C. Development of this software is supported as Human Brain Project/Neuroinformatics research funded by the National Institute of Biomedical Imaging and Bioengineering, and the National Institute of Mental Health."
STRFPAK,,"Theunissen Lab and Gallant Lab, UC-Berkeley",,"Junli Zhang, PhD",junli@socrates.berkeley.edu,http://strfpak.berkeley.edu,now,Web site + email request,STRFPAK-0.1,soon,Yes,,Yes,Only need MATLAB software,See web site,See web site,,"HBP supported, information theory, neural network, segmentation, statistical, STRF estimation, visualization","HPUX, IRIX, Linux, MATLAB, SunOS, UNIX, Windows",09 May 2003,"STRFPAK is a Matlab toolbox for estimating the linear and nonlinear (future versions) stimulus-response transfer function of a sensory neuron. The resulting spatio-temporal receptive field (STRF) provides a quantitative description of neural filtering properties that can be used in subsequent computational modeling studies. The estimation techniques implemented by STRFPAK are quite general. Several algorithms are provided for estimating both linear and nonlinear STRFs from responses to either simple or complex stimuli, including natural signals."
iiV,internet image Viewer,"Cognitive Neuroimaging Unit, VA Medical Center, University of Minnesota, Minneapolis",,Joel T. Lee,jtlee@james.psych.umn.edu,http://james.psych.umn.edu/iiV.html,java archive file,,1.153,"May 20, 2003",No,,Yes,"Java 1.1.8 with swing 1.1.1, or Java 1.3 or higher",,,,"HBP supported, visualization","JVM, Linux, MacOS, SunOS, UNIX, Windows",23 May 2003,"iiV is an interactive brain imaging data display tool written in Java. It displays 3-D data sets as slices perpendicular to the 3 major axis. Individual slice voxels are mapped thru a linear scaling, threshold and color table to displayable pixel values. Any number of slices from any number of data files may be arranged, annotated, overlaid, cropped, zoomed and rotated. iiV maintains the original data internally for mouse selection and display of original voxel values. If input locations map to a real world valued coordinates that mapping may be applied to display selected voxel locations in real coordinates. Slices may also include tracking crosshairs and automatically update to display the same region of the brain as selected in another slice. iiV includes a fairly complete set of editing commands including selection, drag, group, delete, and undo/redo commands. It also includes a script language for saving and reloading of the interactive display and creating animated demos. iiV supports reading ANALYZE, ECAT, ECAT7, DICOM, GIF, JPEG, PPM, Stimulate SDT, and raw data formats and saving what is displayed as scripts, GIF and PPM files."
DicomWorks,,"Universities of Lille and Lyon, France",,Philippe PUECH and Loiec BOUSSEL,"Philippe PUECH ,M.D",http://www.dicomworks.com,Full,Just download and install,1.3.5 'all in one',04082002,No,"Free, by mail",Yes,"French, English, Dutch, German and Spanish versions for Windows 95 (OSR 1 and 2),98,Me,2000, NT(SP1 to 4), and XP. Independant installer (.EXE file) and its content checked with Norton Antivirus 2002 (19/07/2002).",,,,"Export, PowerPoint, surface analysis, visualization",Windows,23 May 2003,"DicomWorks is a DICOM viewer and converter dedicated to radiologists or people working with DICOM files.|It includes : - a smart DICOM viewer with 4 panel display, annotations, arrows, multimodality synchronization, etc... - an export wizard to the most common picture or movie file formats - an export wizard to Microsoft PowerPoint - the most simple and compatible DICOM CD-ROM reader - the most simple and smart DICOM CD-ROM WRITER - an archiving solution with lossless compression of the data - a DICOM creation module to 'dicomize' images from any image source (even video capture) - e-mail or FTP import end export functions (teleradiology) ...and much, much more|Our software includes some functions that are usually lacking in most DICOM viewers, such as AVI export of a series, the transfer of 'windowable' and annotated images by e-mail for teleradiology purpose.|With DicomWorks and a simple PC, you can easily and efficiently view, share, and present your DICOM files and have very powerful export tools at your disposal. So where it the trap ? None; it's FREE. Enjoy and tell us about your experience."
NIH Image,,"Research Services Branch, NIMH",,Wayne Rasband,wsr@nih.gov,http://rsb.info.nih.gov/nih-image/,"Yes, by FTP",http://rsb.info.nih.gov/nih-image/download.html,1.63,"November 19, 2002",Yes,Public domain,Yes,Macintosh computer or Mac emulator,,,,"segmentation, statistical, visualization",MacOS,05 Dec 2005,"(From the NIH Image web site; see http://rsb.info.nih.gov/nih-image/about.html),|NIH Image is a public domain image processing and analysis program for the Macintosh. It was developed at the Research Services Branch (RSB) of the National Institute of Mental Health (NIMH), part of the National Institutes of Health (NIH).|A free PC version of Image, called Scion Image for Windows, is available from Scion Corporation. There is also Image/J, a Java program inspired by Image that 'runs anywhere'.|Image can acquire, display, edit, enhance, analyze and animate images. It reads and writes TIFF, PICT, PICS and MacPaint files, providing compatibility with many other applications, including programs for scanning, processing, editing, publishing and analyzing images. It supports many standard image processing functions, including contrast enhancement, density profiling, smoothing, sharpening, edge detection, median filtering, and spatial convolution with user defined kernels.|Image can be used to measure area, mean, centroid, perimeter, etc. of user defined regions of interest. It also performs automated particle analysis and provides tools for measuring path lengths and angles. Spatial calibration is supported to provide real world area and length measurements. Density calibration can be done against radiation or optical density standards using user specified units. Results can be printed, exported to text files, or copied to the Clipboard.|A tool palette supports editing of color and gray scale images, including the ability to draw lines, rectangles and text. It can flip, rotate, invert and scale selections. It supports multiple windows and 8 levels of magnification. All editing, filtering, and measurement functions operate at any level of magnification and are undoable.|Image directly supports Data Translation and Scion frame grabber cards for capturing images or movie sequences using a TV camera. Acquired images can be shading corrected and frame averaged. Other frame grabbers are supported via plug-in modules.|Image can be customized in three ways: via a built-in Pascal-like macro language, via externally compiled plug-in modules and on the Pascal source code level. Example macros, plug-ins and complete source code can be downloaded from the Download page.|More information about NIH Image can be found in the Overview section of the manual."
ImageJ,,"Research Services Branch, NIMH",,Wayne Rasband,wsr@nih.gov,http://rsb.info.nih.gov/ij/,,Download at http://rsb.info.nih.gov/ij/download.html,1.34,"July 12, 2005",Yes,Public domain,Yes,Java 1.1 or later,,"Abramoff, M.D., Magelhaes, P.J., Ram, S.J. 'Image Processing with ImageJ'. Biophotonics International, volume 11, issue 7, pp. 36-42, 2004.",,"segmentation, statistical, visualization","HPUX, IRIX, Java, Linux, MacOS, SunOS, UNIX, Windows",05 Dec 2005,"(From the ImageJ web site; see http://rsb.info.nih.gov/ij/docs/intro.html),|ImageJ is a public domain Java image processing program inspired by NIH Image for the Macintosh. It runs, either as an online applet or as a downloadable application, on any computer with a Java 1.1 or later virtual machine. Downloadable distributions are available for Windows, Mac OS, Mac OS X and Linux.|It can display, edit, analyze, process, save and print 8-bit, 16-bit and 32-bit images. It can read many image formats including TIFF, GIF, JPEG, BMP, DICOM, FITS and 'raw'. It supports 'stacks', a series of images that share a single window. It is multithreaded, so time-consuming operations such as image file reading can be performed in parallel with other operations.|It can calculate area and pixel value statistics of user-defined selections. It can measure distances and angles. It can create density histograms and line profile plots. It supports standard image processing functions such as contrast manipulation, sharpening, smoothing, edge detection and median filtering.|It does geometric transformations such as scaling, rotation and flips. Image can be zoomed up to 32:1 and down to 1:32. All analysis and processing functions are available at any magnification factor. The program supports any number of windows (images) simultaneously, limited only by available memory.|Spatial calibration is available to provide real world dimensional measurements in units such as millimeters. Density or gray scale calibration is also available.|ImageJ was designed with an open architecture that provides extensibility via Java plugins. Custom acquisition, analysis and processing plugins can be developed using ImageJ's built in editor and Java compiler. User-written plugins make it possible to solve almost any image processing or analysis problem.|ImageJ is being developed on Mac OS X using its built in editor and Java compiler, plus the BBEdit editor and the Ant build tool. The source code is freely available. The author, Wayne Rasband (wayne@codon.nih.gov), is at the Research Services Branch, National Institute of Mental Health, Bethesda, Maryland, USA."
